{
  "schemaVersion": "registry.tribe-identities.v1",
  "environment": "stillness",
  "source": {
    "kind": "community_report",
    "confidence": "reported",
    "title": "Reviewed public tribe identity example",
    "locator": "testdata/fixtures/tribe-identities.reviewed.json",
    "checkedAt": "2026-06-26T00:00:00Z",
    "reviewStatus": "reviewed"
  },
  "tribes": [
    {
      "tribeId": "42",
      "name": "Example Relay",
      "tag": "ER",
      "aliases": ["Relay Example"],
      "description": "Example public tribe profile",
      "url": "https://example.invalid/tribes/example-relay",
      "confidence": "reported",
      "sourceContext": "Fixture showing reviewed public tribe profile fields."
    }
  ]
}
